[
  {
    "id": "proj_marketing",
    "name": "여름 신제품 런칭 캠페인",
    "description": "마케팅팀 · 합성 예시 프로젝트 (우선 시나리오)",
    "domain": "marketing",
    "is_synthetic": true
  },
  {
    "id": "proj_dev",
    "name": "로그 시스템 개편",
    "description": "개발팀 · 합성 예시 프로젝트 (MongoDB 시나리오)",
    "domain": "engineering",
    "is_synthetic": true
  }
]
